Project Name,Id,Developer,Registry,Methodology,Sector,Country,Project Status,Crediting Period Start,Crediting Period End,Annual Est. Units,Total Issued Units,Total Retired Units,Total Available Units
"Grouped Reforestation Project in Indore, India","2584","EKI Energy Services Limited","Verra","AR-ACM0003","Agriculture; forestry and fishing","India",Listed,,,0,0,0,0
"Reforestation of Abandoned Dairy Cattle Grazing Grasslands in Korea","7ZS64IX7RPE80JKMSG78UWDLVVJVG6","n.a.","CDM Registry","CDM - AR-AMS0001","Afforestation and reforestation","Republic of Korea",Registered,2013-03-01T00:00:00.000Z,2033-02-28T00:00:00.000Z,0,0,0,0
"Restoration of degraded areas and reforestation in Cáceres and Cravo Norte, Colombia","576","Asorpar Ltd.","Verra","AR-AM0005","Agriculture; forestry and fishing","Colombia",Registered,,,0,382819,359325,23494
"Land Life Reforestation and Restoration of Degraded Land in Portugal","4821","Land Life Company BV","Verra","AR-ACM0003","Agriculture; forestry and fishing","Portugal",Listed,,,0,0,0,0
"Lanao del Sur Bamboo Reforestation Project","2958","EcoPlanet Bamboo Group","Verra","ACM0003","Agriculture; forestry and fishing","Philippines",Registered,,,0,0,0,0
"Agroforestry and Reforestation for Carbon Sequestration in Indonesia","3012","The PURE PROJECT SAS","Verra","AR-AMS0007","Agriculture; forestry and fishing","Indonesia",Listed,,,0,0,0,0
"Bagepalli CDM Reforestation Programme","GS4240","Agricultural Development and Training Society","Gold Standard","GS - AFFORESTATION/REFORESTATION GHG EMISSIONS REDUCTION & SEQUESTRATION METHODOLOGY","Afforestation","India",Registered,,,0,0,0,0
"REFORESTATION OF DEGRADED/DEGRADING LAND IN THE CARIBBEAN SAVANNAH OF COLOMBIA","NCIY1QEW6TLRFYDGBIK0YWZ4U3VPUN","WB-CF","CDM Registry","CDM - AR-AM0009","Afforestation and reforestation","Colombia",Registered,2008-06-18T00:00:00.000Z,2028-06-17T00:00:00.000Z,0,0,0,0
"Serra do Sudeste Landscape Restoration and Reforestation Project","2359","The Green Branch","Verra","AR-AMS0007","Agriculture; forestry and fishing","Brazil",Listed,,,0,0,0,0
"Reforestation of degraded land in Spain","3419","Land Life Company BV","Verra","AR-ACM0003","Agriculture; forestry and fishing","Spain",Listed,,,0,0,0,0
"Reforestation Program in the Southeastern Region of Nicaragua on degraded pastureland","GS4220","Across Forest","Gold Standard","GS - AFFORESTATION/REFORESTATION GHG EMISSIONS REDUCTION & SEQUESTRATION METHODOLOGY","Afforestation","Nicaragua",Registered,,,0,0,0,0
"Grouped Reforestation Project by Cropzone Agro Forestry Private Limited","2833","CropZone Agro Forestry Private Limited","Verra","AR-ACM0003","Agriculture; forestry and fishing","India",Registered,,,0,40303,1350,38953
"Udzungwa Corridor Reforestation","3602","Udzungwa Corridor Limited","Verra","AR-ACM0003","Agriculture; forestry and fishing",--,Registered,,,0,0,0,0
"Aberdare Range / Mt. Kenya Small Scale Reforestation Initiative - Karuri Small Scale A/R Project","N5AO1NW28HKEOFTMY3COMTJDDC7FP8","Joanneum Research, UNIQUE forestry consultants, Green belt movement","CDM Registry","CDM - AR-AMS0001","Afforestation and reforestation","Kenya",Withdrawn,2007-10-01T00:00:00.000Z,2027-10-01T00:00:00.000Z,0,0,0,0
"Ganaderos Y Bosques Azuero: Reforestation of Riparian Areas and Rotational Grazing on Cattle Farms in the Azuero Peninsula, Panama","5180","rePLANET","Verra","VCS-VM0042","Agriculture; forestry and fishing","Panama",Listed,,,0,0,0,0
"Reforestation Across the Lower Mississippi Valley","774","Dynegy Inc.","Verra","AR-ACM0001","Agriculture; forestry and fishing","United States of America",Registered,,,0,0,0,0
"Conservation and reforestation of degraded areas in Barbosa, Colombia","GS3025","Deactivated Projects","Gold Standard","GS - AFFORESTATION/REFORESTATION GHG EMISSIONS REDUCTION & SEQUESTRATION METHODOLOGY","Afforestation","Colombia",Registered,,,0,0,0,0
"Uganda Nile Basin Reforestation Project No 4","A7GM01SAIP8LCBINBODJ5K7X8XV5W2","WB-CF, UNIQUE forestry consultants","CDM Registry","CDM - AR-AMS0001","Afforestation and reforestation","Uganda",Registered,2008-04-01T00:00:00.000Z,2028-03-31T00:00:00.000Z,3276,3276,358,2918
"GHG Programme-Afforestation and Reforestation Group1 - Withdrawn","EZOCHZZF0I2SUU8DI099OWBGE4CSPR","Kanaka Management Services","CDM Registry","CDM - AR-AM0014","NA","Mozambique",Withdrawn,2019-11-30T00:00:00.000Z,2026-11-29T00:00:00.000Z,0,0,0,0
"Community-based Reforestation on Degraded Lands in East Lombok","VTSBU6NLI63QVVLY3RJZQH2IZ3GZOJ","Korea International Cooperation Agency","CDM Registry","CDM - AR-AMS0004","Afforestation and reforestation","Indonesia",Withdrawn,2010-12-01T00:00:00.000Z,2030-12-01T00:00:00.000Z,0,0,0,0
"Uganda Nile Basin Reforestation Project No.3","FQGS8PBL08KI02MK9PEC5TY2K3G1MS","WB-CF, Joanneum Research","CDM Registry","CDM - AR-AMS0001","Afforestation and reforestation","Uganda",Registered,2007-04-01T00:00:00.000Z,2027-03-31T00:00:00.000Z,17386,17386,1901,15485
"Reforestation of degraded land in Chhattisgarh, India","689","Prakash Industries Limited","Verra","AR-ACM0002","Agriculture; forestry and fishing","India",Registered,,,0,58122,38958,19164
"Panna Afforestation and Reforestation Project","4811","Climate Impact Partners Limited","Verra","VM0047","Agriculture; forestry and fishing","India",Listed,,,0,0,0,0
"Aberdare Range / Mt. Kenya Small Scale Reforestation Initiative - Kabaru-Thigu-Mugunda Small Scale A/R Project","KCYENSZAUVOA0833HAKWMPY09VM2S8","Joanneum Research, UNIQUE forestry consultants, Green belt movement","CDM Registry","CDM - AR-AMS0001","Afforestation and reforestation","Kenya",Withdrawn,2007-10-01T00:00:00.000Z,2027-10-01T00:00:00.000Z,0,0,0,0
"Reforesting Degraded Lands in Chile through the use of Mycorrhizal Inoculation","1055","Mikro-Tek Inc.","Verra","AR-ACM0003","Agriculture; forestry and fishing","Chile",Registered,,,0,1418794,1201384,217410
"Reforestation activities in Brazil for carbon removals from the atmosphere","4729","SADA PARTICIPAÇÕES LTDA","Verra","AR-ACM0003","Agriculture; forestry and fishing","Brazil",Listed,,,0,0,0,0
"Reforestation of pastures in Campo Verde with native species, Pucallpa, Peru","658","Bosques Amazónicos","Verra","AR-AM0003","Agriculture; forestry and fishing","Peru",Registered,,,0,42625,42625,0
"Commercial reforestation on lands dedicated to extensive cattle grazing activities in the region of Magdalena Bajo Seco","BCR-CO-656-14-001","ONF INTERNATIONAL","BioCarbon Standard","CDM - AR-ACM0003","Forestry","Colombia",Registered,,,0,540771,5540,535231
"EcoMakala Virunga Reforestation project","GS5618","CO2logic","Gold Standard","GS - AFFORESTATION/REFORESTATION GHG EMISSIONS REDUCTION & SEQUESTRATION METHODOLOGY","Afforestation","Democratic Republic of Congo",Registered,,,0,0,0,0
"Uganda Nile Basin Reforestation Project No 1","8ORR5UWVWRQND30WV8VVWBTPPPNEPQ","WB-CF, UNIQUE forestry consultants","CDM Registry","CDM - AR-AMS0001","Afforestation and reforestation","Uganda",Registered,2009-04-01T00:00:00.000Z,2029-03-31T00:00:00.000Z,1221,1221,134,1087
"Reforestation Project at Shree Nasik Panchavati Panjrapole (SNPP), Nasik, India","4BKDL3MXQJGEHOFG4IYYCEWBQ4OKP0","SEE Tech Solutions","CDM Registry","CDM - AR-AM0001","Afforestation and reforestation","India",Withdrawn,2007-01-01T00:00:00.000Z,2036-12-31T12:00:00.000Z,0,0,0,0
"Facilitating Reforestation for Guangxi Watershed Management in Pearl River Basin","KNGJ1V3IYZYVJKLSQLNHTZ02F9QCM4","WB-CF, Joanneum Research","CDM Registry","CDM - AR-AM0001","Afforestation and reforestation","China",Registered,2006-04-01T00:00:00.000Z,2036-03-31T00:00:00.000Z,450527,450527,48276,402251
"Grouped project for reforestation on degraded and non-forest lands","2531","EKI Energy Services Limited","Verra","AR-AM0014","Agriculture; forestry and fishing","India",Listed,,,0,0,0,0
"Multi-Species Reforestation in Mato Grosso, Brazil","665","Not specified","Verra","AR-AMS0006","Agriculture; forestry and fishing","Brazil",Registered,,,0,513482,338108,175374
"Reforestation of Degraded Lands in Sierra Leone","2401","Miro Forestry Developments Limited","Verra","AR-AM0003","Agriculture; forestry and fishing","Sierra Leone",Listed,,,0,578870,328612,250258
"IMPACT REFORESTATION IN THE CHACO PROJECT","2496","Investancia Paraguay S.A.","Verra","AR-ACM0003","Agriculture; forestry and fishing","Paraguay",Registered,,,0,0,0,0
"Afforestation and Reforestation on Degraded Lands in Northwest Sichuan, China","1BRLOQ1EAXAY6BE0LOTZOIPBKJ5RA3","Conservation International, The Nature Conservancy","CDM Registry","CDM - AR-AM0003","Afforestation and reforestation","China",Registered,2007-01-04T00:00:00.000Z,2027-01-03T00:00:00.000Z,0,0,0,0
"Mangrove afforestation and reforestation project in Cambodia","5071","Not specified","Verra","VCS-VM0033","Agriculture; forestry and fishing","Cambodia",Listed,,,0,0,0,0
"Reforestation in Mountanous Communities of Yunnan","GS2466","Initiative Developpement","Gold Standard","GS - AFFORESTATION/REFORESTATION GHG EMISSIONS REDUCTION & SEQUESTRATION METHODOLOGY","Afforestation","China",Registered,,,0,0,0,0
"Land Life Reforestation and Restoration of Degraded Land in Spain - B","4739","Deeprock Net Zero Technology (Shenzhen) Co.","Verra","AR-ACM0003","Agriculture; forestry and fishing","Spain",Listed,,,0,0,0,0
"GHG Programme-Afforestation and Reforestation Group2","5KETTQG0QD22UWHZA4465KXKLE6KU9","NA","CDM Registry","CDM - AR-ACM0003","NA","Mozambique",Validated,2020-02-19T00:00:00.000Z,2027-02-18T00:00:00.000Z,0,0,0,0
"Small-scale Reforestation for Landscape Restoration.","SGHEJBI0Y6FB6YO5DU8V1LA4LEZZAL","Beijing Arreon Corporation","CDM Registry","CDM - AR-AMS0001","Afforestation and reforestation","China",Validated,2007-06-01T00:00:00.000Z,2037-05-31T12:00:00.000Z,0,0,0,0
"Land Life Reforestation and Restoration of Degraded Land in Spain - A","4741","Defined B.V.","Verra","AR-AM0003","Agriculture; forestry and fishing","Spain",Listed,,,0,0,0,0
"Reforestation grouped project Norteak Nicaragua","2647","Norteak Nicaragua S.A.","Verra","AR-ACM0003","Agriculture; forestry and fishing","Nicaragua",Listed,,,0,29419,0,29419
"Urban reforestation and revegetation in the UK","4936","Carbon Heroes ltd","Verra","VM0047","Agriculture; forestry and fishing","United Kingdom",Listed,,,0,0,0,0
"Reforestation of deforested land in Madagascar","1327","EcoFormation","Verra","AR-ACM0003","Agriculture; forestry and fishing","Madagascar",Registered,,,0,0,0,0
"Ankeniheny-Zahamena-Mantadia Biodiversity Conservation Corridor and Restoration Project (Reforestation Component)","7COYHD5A226DPJ9MMFBP9CGGTSAWSA","WB-CF","CDM Registry","CDM - AR-AMS0001","Afforestation and reforestation","Madagascar",Withdrawn,2007-12-03T00:00:00.000Z,2027-12-03T00:00:00.000Z,0,0,0,0
"Reforestation project using native species in Maringa-Lopori-Wamba region (Democratic Republic of Congo): establishment of the "Bonobo Peace Forest"","96G0M9Q69QM250KM51XO0SFEWR47WD","Institut Congolais pour la Conservation de la Nature, University of Florence","CDM Registry","CDM - AR-AM0001","Afforestation and reforestation","Democratic Republic of Congo",Withdrawn,2009-01-01T00:00:00.000Z,2039-01-01T12:00:00.000Z,0,0,0,0
"CARBON SEQUESTRATION THROUGH REFORESTATION IN THE BOLIVIAN TROPICS BY SMALLHOLDERS OF FSCIPAY (La Federación Sindical de Comunidades Interculturales Productores Agropecuarios de Yapacaní)","06BPZD10ANRN889HD6IGZY9MMSDCRX","n.a.","CDM Registry","CDM - AR-AMS0001","Afforestation and reforestation","Bolivia",Withdrawn,2007-11-20T00:00:00.000Z,2028-11-19T06:00:00.000Z,0,0,0,0
"Futuro Forestal Nicaragua Reforestation Program","842J7KCG5SRVNU5AZ2O6DK8SK18ND1","WB-CF, Opera","CDM Registry","CDM - AR-AM0004","NA","Nicaragua",Validated,2007-05-28T00:00:00.000Z,2014-05-27T00:00:00.000Z,0,0,0,0
"THAMMA RAKSA - REFORESTATION AND LAND RESTORATION IN THAILAND","3581","The PURE PROJECT SAS","Verra","VCS-AR-AMS0007","Agriculture; forestry and fishing","Thailand",Listed,,,0,0,0,0
"Carbono Flor y Nuevo","3","Forestry Consulting Group S.A.S.","Cercarbono","CDM - AR-ACM0003: Afforestation and reforestation of lands except wetlands","Agriculture; forestry and fishing","Colombia",Approved,,,0,30962,26318,4644
"CARBONO GRESCO2","17","Forestry Consulting Group S.A.S.","Cercarbono","CCB - M/UT/F-A01: Methodology To Implement GHG Removal Projects Through Reforestation, Forest Restoration and the Establishment of Woody Crops","Agriculture; forestry and fishing","Colombia",Approved,,,0,464752,281592,183160
"Carbono Verde","79","Tekia S.A.S","Cercarbono","CDM - AR-ACM0003: Afforestation and reforestation of lands except wetlands","Agriculture; forestry and fishing","Colombia",Approved,,,0,141329,33841,107488
"Carbono Agroporvanda","1","Forestry Consulting Group S.A.S.","Cercarbono","CDM - AR-ACM0003: Afforestation and reforestation of lands except wetlands","Agriculture; forestry and fishing","Colombia",Approved,,,0,81169,68994,12175
"Bonos Verdes Colombia Grupo Custodiar S.A.","15","South Pole Carbon Asset Management","Cercarbono","CDM - AR-ACM0003: Afforestation and reforestation of lands except wetlands","Agriculture; forestry and fishing","Colombia",Approved,,,0,865055,732466,132589
"Proyecto Carbono CAS","73","Compañia Agricola de la Sierra Sucursal Colombia","Cercarbono","CDM - AR-ACM0003: Afforestation and reforestation of lands except wetlands","Agriculture; forestry and fishing","Colombia",Approved,,,0,1428514,32212,1396302
"Rio Crepori REDD+ Project","129","Indigenous Carbon LLC","Cercarbono","CCB - M/UT/F-A01: Methodology To Implement GHG Removal Projects Through Reforestation, Forest Restoration and the Establishment of Woody Crops","Agriculture; forestry and fishing","Brazil",Registered,,,0,0,0,0
"CARBONO NEGOCIOS AGROFORESTALES","21","Forestry Consulting Group S.A.S.","Cercarbono","CDM - AR-ACM0003: Afforestation and reforestation of lands except wetlands","Agriculture; forestry and fishing","Colombia",Approved,,,0,104112,38382,65730
"Carbono Hass","181","Forestry Consulting Group S.A.S.","Cercarbono","CCB - M/UT/F-A01: Methodology To Implement GHG Removal Projects Through Reforestation, Forest Restoration and the Establishment of Woody Crops","Agriculture; forestry and fishing","Colombia",Approved,,,0,21026,110,20916
"Carbono Bagatela","23","Forestry Consulting Group S.A.S.","Cercarbono","CCB - M/UT/F-A01: Methodology To Implement GHG Removal Projects Through Reforestation, Forest Restoration and the Establishment of Woody Crops","Agriculture; forestry and fishing","Colombia",Approved,,,0,86699,48627,38072
"Reforestación de suelos degradados por la ganadería y la agricultura en Antioquia","13","South Pole Carbon Asset Management","Cercarbono","CDM - AR-ACM0003: Afforestation and reforestation of lands except wetlands","Agriculture; forestry and fishing","Colombia",Approved,,,0,92661,78762,13899
"Vilhena REDD+ Project","138","Indigenous Carbon LLC","Cercarbono","CCB - M/UT/F-A01: Methodology To Implement GHG Removal Projects Through Reforestation, Forest Restoration and the Establishment of Woody Crops","Agriculture; forestry and fishing","Brazil",Approved,,,0,0,0,0
"Carbono La Puya y San Lorenzo","5","Forestry Consulting Group S.A.S.","Cercarbono","CDM - AR-ACM0003: Afforestation and reforestation of lands except wetlands","Agriculture; forestry and fishing","Colombia",Approved,,,0,60535,43883,16652
"CARBONO RINCCO","59","Forestry Consulting Group S.A.S.","Cercarbono","CDM - AR-ACM0003: Afforestation and reforestation of lands except wetlands","Agriculture; forestry and fishing","Colombia",Approved,,,0,307899,37379,270520
"MultiAntioquia","26","Forestry Consulting Group S.A.S.","Cercarbono","CDM - AR-ACM0003: Afforestation and reforestation of lands except wetlands","Agriculture; forestry and fishing","Colombia",Approved,,,0,136268,115827,20441
"Proyecto de Mitigación Forestal Bonanza Verde","12","South Pole Carbon Asset Management","Cercarbono","CDM - AR-ACM0003: Afforestation and reforestation of lands except wetlands","Agriculture; forestry and fishing","Colombia",Approved,,,0,12759,10845,1914
"Carbono Agrorios","2","Forestry Consulting Group S.A.S.","Cercarbono","CDM - AR-ACM0003: Afforestation and reforestation of lands except wetlands","Agriculture; forestry and fishing","Colombia",Approved,,,0,11195,9516,1679
"Rio Maicimirim REDD+ Project","144","PARATINTIN OPIPAM DO AMAZONAS","Cercarbono","CCB - M/UT/F-A01: Methodology To Implement GHG Removal Projects Through Reforestation, Forest Restoration and the Establishment of Woody Crops","Agriculture; forestry and fishing","Brazil",Approved,,,0,2829681,0,2829681
"SKCARBONO","46","Forestry Consulting Group S.A.S.","Cercarbono","CDM - AR-ACM0003: Afforestation and reforestation of lands except wetlands","Agriculture; forestry and fishing","Colombia",Approved,,,0,6808908,4157344,2651564
"Programa de Compensaciones de Gases de Efecto Invernadero (GEI) – Reforestadora Cacerí S.A.","32","Forestry Consulting Group S.A.S.","Cercarbono","CCB - M/UT/F-A01: Methodology To Implement GHG Removal Projects Through Reforestation, Forest Restoration and the Establishment of Woody Crops","Agriculture; forestry and fishing","Colombia",Approved,,,0,188603,160313,28290
"Proyecto Forestal de Mitigación de Cambio Climático en áreas degradadas por ganadería Fincas La Clara y Suebrá","11","South Pole Carbon Asset Management","Cercarbono","CDM - AR-ACM0003: Afforestation and reforestation of lands except wetlands","Agriculture; forestry and fishing","Colombia",Approved,,,0,37305,31709,5596
"Proyecto forestal de mitigación de cambio climático “Forestal de La Orinoquía”","8","South Pole Carbon Asset Management","Cercarbono","CDM - AR-ACM0003: Afforestation and reforestation of lands except wetlands","Agriculture; forestry and fishing","Colombia",Approved,,,0,1156938,972105,184833
"Bonos de Carbono Caracoli","10","Forestry Consulting Group S.A.S.","Cercarbono","CCB - M/UT/F-A01: Methodology To Implement GHG Removal Projects Through Reforestation, Forest Restoration and the Establishment of Woody Crops","Agriculture; forestry and fishing","Colombia",Approved,,,0,202005,126861,75144
"Carbono Ganados y Bosques","30","Forestry Consulting Group S.A.S.","Cercarbono","CDM - AR-ACM0003: Afforestation and reforestation of lands except wetlands","Agriculture; forestry and fishing","Colombia",Approved,,,0,225734,147664,78070
"Carbono Reforesta","24","Forestry Consulting Group S.A.S.","Cercarbono","CDM - AR-ACM0003: Afforestation and reforestation of lands except wetlands","Agriculture; forestry and fishing","Colombia",Approved,,,0,13628,11584,2044
"Carbono Inmunizar","42","Forestry Consulting Group S.A.S.","Cercarbono","CDM - AR-ACM0003: Afforestation and reforestation of lands except wetlands","Agriculture; forestry and fishing","Colombia",Approved,,,0,27491,23366,4125
"Carbono Paja Perdida","4","Forestry Consulting Group S.A.S.","Cercarbono","CDM - AR-ACM0003: Afforestation and reforestation of lands except wetlands","Agriculture; forestry and fishing","Colombia",Approved,,,0,97199,82618,14581
"Carbono Nueva Esperanza","43","Forestry Consulting Group S.A.S.","Cercarbono","CDM - AR-ACM0003: Afforestation and reforestation of lands except wetlands","Agriculture; forestry and fishing","Colombia",Approved,,,0,52601,44712,7889
"Carbono Reforestadora El Guásimo","49","Reforestadora el Gúasimo SAS","Cercarbono","CDM - AR-ACM0003: Afforestation and reforestation of lands except wetlands","Agriculture; forestry and fishing","Colombia",Approved,,,0,438683,287008,151675
"CARBONO SANTA INES","97","AGROINDUSTRIAS SANTA INES S.A.S. - AGROSI S.A.S.","Cercarbono","CDM - AR-ACM0003: Afforestation and reforestation of lands except wetlands","Agriculture; forestry and fishing","Colombia",Approved,,,0,59872,0,59872
"Programa de Compensación de Emisiones  Cipreses de Colombia S.A.","75","Cipreses de Colombia S.A","Cercarbono","CDM - AR-ACM0003: Afforestation and reforestation of lands except wetlands","Agriculture; forestry and fishing","Colombia",Approved,,,0,458425,532263,-73838
"Reforestación Comercial en Meta","7","South Pole Carbon Asset Management","Cercarbono","CDM - AR-ACM0003: Afforestation and reforestation of lands except wetlands","Agriculture; forestry and fishing","Colombia",Approved,,,0,482250,409914,72336
"Carbono Rancho Victoria","180","Forestry Consulting Group S.A.S.","Cercarbono","CCB - M/UT/F-A01: Methodology To Implement GHG Removal Projects Through Reforestation, Forest Restoration and the Establishment of Woody Crops","Agriculture; forestry and fishing","Colombia",Approved,,,0,217707,0,217707
"Alta Tapajos REDD+ Project","132","Indigenous Carbon LLC","Cercarbono","CCB - M/UT/F-A01: Methodology To Implement GHG Removal Projects Through Reforestation, Forest Restoration and the Establishment of Woody Crops","Agriculture; forestry and fishing","Brazil",Registered,,,0,0,0,0
"Recuperación de suelos degradados con el uso de incentivos financieros en el centro y oriente de Colombia","14","South Pole Carbon Asset Management","Cercarbono","CDM - AR-ACM0003: Afforestation and reforestation of lands except wetlands","Agriculture; forestry and fishing","Colombia",Approved,,,0,453585,364435,89150
"CARBONO OXIGENO PARA TODOS","19","Forestry Consulting Group S.A.S.","Cercarbono","CDM - AR-ACM0003: Afforestation and reforestation of lands except wetlands","Agriculture; forestry and fishing","Colombia",Approved,,,0,196925,167385,29540
"Carvida Duratex","68","Duratex S.A.","Cercarbono","CDM - AR-ACM0003: Afforestation and reforestation of lands except wetlands","Agriculture; forestry and fishing","Colombia",Approved,,,0,702900,322308,380592
"PROYECTO ASOCIATIVO PROGRAMÁTICO ZONA ANDINA Y COSTA ATLÁNTICA - FCG","29","Forestry Consulting Group S.A.S.","Cercarbono","CDM - AR-ACM0003: Afforestation and reforestation of lands except wetlands","Agriculture; forestry and fishing","Colombia",Approved,,,0,1516631,1037105,479526
"Proyecto de mitigación en el sector del uso del suelo cambio en el uso del suelo y silvicultura por remociones debidas al establecimiento de sistemas forestales de Hevea brasiliensis en el municipio de Barrancabermeja, Santander, Colombia.","25","AGI Ambiental","Cercarbono","CDM - AR-ACM0003: Afforestation and reforestation of lands except wetlands","Agriculture; forestry and fishing","Colombia",Approved,,,0,27028,18382,8646
"Proyecto Forestal CO2Cero Reforestadores Vichada-Meta","PCR-CO-ECO-14-003","Participantes de la iniciativa Agrolar SAS, Bazim SAS, Agroforestales Bonanza SAS, Carlos Beltrán, Compadres SAS, El Capricho Vichada SAS, Hernán Trujillo, Inversiones Guardabosques de Colombia SAS, La Fortuna Andrea SAS, Punta de Garzas Inversiones Forestales SAS y Terramax SAS.","BioCarbon Standard","CDM - AR-ACM0003","Forestry","Colombia",De-registered,,,0,0,0,0
"LIGNUS - BONOS DE CARBONO","232","Forestry Consulting Group S.A.S.","Cercarbono","CCB - M/UT/F-A01: Metodología para Implementar Proyectos de Remoción de GEI Mediante Reforestación, Restauración Forestal y Establecimiento de Cultivos Leñosos","Agriculture; forestry and fishing","Colombia",Registered,,,0,0,0,0
"Reforestación de la Cuenca del Río Cauca","BCR-CO-313-14-002","María González","BioCarbon Standard","Cuantificación de la reducción de emisiones de GEI. Actividades que evitan el cambio de uso de la tierra en sabanas naturales","Forestry","Colombia",Rejected,,,0,0,0,0
"ReforesTerra Grouped Project","3166","ReforesTerra – Restauração de Ecossistemas Florestais Ltda","Verra","ACM0003","Agriculture; forestry and fishing","Brazil",Listed,,,0,0,0,0
"RE.GREEN ATLANTIC FOREST REFORESTATION/RESTORATION PROJECT","3743","Re.Green Participações S.A.","Verra","AR-ACM0003","Agriculture; forestry and fishing","Brazil",Listed,,,0,0,0,0
"RE.GREEN AMAZON FOREST REFORESTATION/RESTORATION PROJECT","3772","Re.Green Participações S.A.","Verra","AR-ACM0003","Agriculture; forestry and fishing","Brazil",Listed,,,0,0,0,0